제품군,항목명,설명
와인셀러,컴프레서,"기체를 피스톤 운동으로 압축시켜 압력을 높이는 장치입니다. 액체를 압축시키는 펌프와 같은 원리로 공기를 압축한 힘으로 냉장고, 에어컨, 보일러 등의 제품을 작동할 수 있게 만들어 줍니다."
와인셀러,스마트 진단,제품의 고장 원인을 진단할 수 있는 기능입니다. 제품에 스마트 진단 로고가 있는 모델에만 적용되며 진단을 진행하는 동안 진단음이 발생하므로 상담원 연결 시에만 사용하시고 평상시에는 작동하지 마시기 바랍니다.
와인셀러,저진동,진동과 소음을 개선한 인버터 컴프레서를 적용하여 품질을 최상의 상태로 유지시키는데 도움을 줍니다.
와인셀러,자외선 차단,다중 글라스 도어가 빛에 민감한 와인을 자외선으로부터 지켜주어 와인의 품질을 유지시켜주는 기능입니다.
와인셀러,미세온도조절,온도에 민감한 와인 보관을 위해 1℃ 단위의 미세 온도 조절이 가능하여 와인 종류에 맞춘 최적의 온도로 맛과 향을 오랫동안 유지시켜 줍니다.
와인셀러,멀티존 온도설정,"위칸과 아래칸 온도를 독립적으로 조절할 수 있어 레드 와인과 화이트 와인을 나누어 보관하거나 
필요에 따라 한 가지 와인만 보관하도록 설정할 수 있습니다."
와인셀러,습도케어,"와인 보관 최적 습도를 제공하여 와인의 산화 및 오염을 막아주어, 와인 그대로의 맛과 향을 오래 유지시킵니다."
와인셀러,잠금장치,도어 잠금 기능이 있어 소중한 와인을 아이들의 장난이나 도난 사고로부터 안전하게 지켜드립니다.
