taste_id,인테리어_스타일,메이트_구성,우선순위,예산_범위,선호_라인업,리뷰_기반_추천문구,AI_기반_추천문구
1,모던 & 미니멀 (Modern & Minimal),나 혼자 산다 (1인 가구),인테리어를 완성하는 디자인,500만원 미만 (실속형),500만원 미만 (실속형),"혼자만의 모던 & 미니멀 무드를 완성하는 스타일

당신의 인테리어를 완성하는 디자인를 반영해

LG 트롬 오브제컬렉션 세탁기21kg1등급, LG 트롬 오브제컬렉션 세탁기21kg1등급 중심으로 구성했어요.

리뷰에서 자주 언급되는 세탁, 가전은, 세탁기, 너무, 좋아요 등의 특징이 돋보여요.

500만원 미만 (실속형) 예산 안에서 인테리어를 완성하는 디자인와 기능성을 모두 담았어요.","혼자만의 모던 & 미니멀 무드를 완성하는 오브제컬렉션 스타일

당신의 공간 분위기와 인테리어를 완성하는 디자인를 반영해

오브제컬렉션 소형 냉장고, 스타일리시 인덕션, 세련된 식기세척기 중심으로 구성했어요.
500만원 미만 (실속형) 예산 안에서 인테리어를 완성하는 디자인와 기능성을 모두 담았어요."
2,모던 & 미니멀 (Modern & Minimal),나 혼자 산다 (1인 가구),인테리어를 완성하는 디자인,500만원 미만 (실속형),"500만원 ~ 1,500만원 (표준형)","혼자만의 모던 & 미니멀 무드를 완성하는 스타일

당신의 인테리어를 완성하는 디자인를 반영해

LG 디오스 AI 오브제컬렉션 STEM 베이직 냉장고 (매직스페이스)854L1등급, LG 디오스 오브제컬렉션 STEM 얼음정수 냉장고 (노크온 매직스페이스)817L2등급 중심으로 구성했어요.

리뷰에서 자주 언급되는 냉장고, 너무, 좋아요, 서비스, 얼음정수 등의 특징이 돋보여요.

/ 한 달
LG 디오스 AI 오브제컬렉션 STEM 냉장고를 사용하고 있는데요,
가족 모두 너무 만족하고 있어서
지인들에게 만날 때마다 추천을 하고 있어요 ^^

직수형 냉장고라 직수관 연결이 필요한데, 깔끔한 설치부터
매일 깨끗한 물과 얼음을
내가 원할 땐 언제든 편하게 사용할 수 있다는 점에서
생각보다 큰 만족감을 주더라고요 효율적인 수납은 물론 디자인 면에 있어서도
포인트가 되어주는 노크온 디스플레이 덕분에 내부 식재료도 확인 가능해서
그만큼 애정이 생기는 디자인입니다 😊

아이스 음료 너무 좋아하고
냉장고 교체 계획이 있으신 분들이라면
저는 정말로 강추!!

500만원 미만 (실속형) 예산 안에서 인테리어를 완성하는 디자인와 기능성을 모두 담았어요.","혼자만의 모던 & 미니멀 무드를 완성하는 오브제컬렉션 스타일

당신의 공간 분위기와 인테리어를 완성하는 디자인를 반영해

오브제컬렉션 소형 냉장고, 스타일리시 인덕션, 세련된 식기세척기 중심으로 구성했어요.
500만원 미만 (실속형) 예산 안에서 인테리어를 완성하는 디자인와 기능성을 모두 담았어요."
3,모던 & 미니멀 (Modern & Minimal),나 혼자 산다 (1인 가구),인테리어를 완성하는 디자인,500만원 미만 (실속형),"1,500만원 ~ 3,000만원 (고급형)","혼자만의 모던 & 미니멀 무드를 완성하는 스타일

당신의 인테리어를 완성하는 디자인를 반영해

LG 트롬 오브제컬렉션 세탁기21kg1등급, LG 트롬 오브제컬렉션 세탁기25kg1등급 중심으로 구성했어요.

리뷰에서 자주 언급되는 세탁, 가전은, 세탁기, 너무, 좋아요 등의 특징이 돋보여요.

500만원 미만 (실속형) 예산 안에서 인테리어를 완성하는 디자인와 기능성을 모두 담았어요.","혼자만의 모던 & 미니멀 무드를 완성하는 오브제컬렉션 스타일

당신의 공간 분위기와 인테리어를 완성하는 디자인를 반영해

오브제컬렉션 소형 냉장고, 스타일리시 인덕션, 세련된 식기세척기 중심으로 구성했어요.
500만원 미만 (실속형) 예산 안에서 인테리어를 완성하는 디자인와 기능성을 모두 담았어요."
