제품군,항목명,설명
TV,프라이빗 커버,"스마트 캠을 사용하지 않을 경우 프라이빗 커버를 닫아 주면 화면이 촬영되지 않습니다. 내장된 커버로 카메라 렌즈를 차단함으로써 해킹 피해를 방지해 줍니다.
* 카메라 사용 중일 때, 빨간색 불빛이 나옵니다."
TV,마이크 개수,"LG 스마트 캠은 양쪽에 내장된 듀얼 마이크를 통해 어느 위치에서도 입체감 있는 목소리를 전달해 줍니다. 지원하는 앱의 메뉴에 따라 카메라, 마이크의 ON/OFF 기능을 지원합니다."
TV,인터페이스,"터치 스크린 환경에 최적화된 대시보드를 지원하여, 마치 스마트폰이나 태블릿을 이용하듯 하단 런처를 통해 원하는 기능을 빠르게 불러올 수 있고 자주 쓰는 기능을 홈 화면에 배치해 이용하는 것도 가능합니다. PC에서 흔히 볼 수 있는 윈도우 운영체제 특유의 데스크톱 UI를 원하는 사용자를 위해 터치 메뉴를 빠르게 전환하는 기능도 제공합니다."
TV,전원,"TV가 정상적으로 작동하기 위해 요구되는 전압 범위인 정격 전압(V)과 전원이 공급되는 전력의 주기적 변동 속도인 주파수(Hz)를 나타냅니다. 어댑터는 TV에 안정적인 전원을 공급하는 장치이며, 이를 위해 TV를 작동하면 어댑터는 쉴새 없이 220V의 교류 전압을 19V 직류 전압으로 변환을 합니다."
TV,지원모델,"LG 스마트 TV 독자 플랫폼인 webOS에 최적화해 TV 본체와 연결하면 별도의 프로그램을 설치하지 않아도 간편하게 사용할 수 있습니다. webOS 어플리케이션 가운데 홈트레이닝, 댄스 강습 플랫폼을 이용하는 고객들은 스마트 캠을 이용해 본인의 동작과 코칭 영상을 동시에 보면서 배울 수 있어 더 효과적입니다."
TV,모바일 화면 공유(Android),스마트폰의 화면과 소리를 TV와 무선으로 연결하여 TV의 큰 화면에서 즐길 수 있는 기능입니다. 화면 공유 기능을 지원하는 스마트폰이라면 별도의 케이블 없이도 TV에 스마트폰 화면을 공유할 수 있습니다.
TV,FreeSync Compatible (AMD),게임 중 발생하는 화면 찢어짐(tearing)과 버벅거림(stuttering)을 줄여 매끄럽고 순조로운 움직임을 경험할 수 있습니다.
TV,모바일 리모컨 지원,"제품을 LG ThinQ 앱에 등록하면 스마트폰을 리모컨처럼 사용할 수 있습니다. TV 전원을 켜고 끌 수 있을 뿐만 아니라, 볼륨 및 채널을 제어할 수 있습니다."
TV,패밀리 세팅,"패밀리 케어(Family Care)는 TV 시청 시작 시간과 종료 시간을 입력 및 제어하는 사용 시간 설정, 시력 보호를 위해 블루라이트를 감소시켜주는 기능, 청력 보호를 위해 TV 볼륨의 최대치를 낮추는 기능, TV 총 사용 시간과 앱 사용 목록을 모니터링하는 스크린 타임 분석 기능 등 가족들의 TV 시청 환경을 위해 다양한 설정을 제공하는 기능입니다."
TV,USB 카메라 호환,"마이크가 포함된 스마트캠을 TV 후면에 붙이고, 부착된 스마트캠을 동봉된 USB 케이블을 이용하여 TV의 USB 단자에 연결할 수 있습니다."
TV,스피커 채널,채널은(Ch)은 하나의 음원 안에 독립적으로 저장 및 재생되는 각각의 소리를 의미합니다. 채널이 많을수록 소리가 여러 스피커를 통해 분산되어 나옵니다. 
TV,오디오 지원 코덱,음성 또는 영상 신호를 디지털 신호로 변환하고 반대로 압축된 디지털 신호를 음성이나 영상으로 풀어 재생하는 소프트웨어나 장치입니다.
TV,USB,"TV에 USB 저장 장치를 연결하면 USB 저장 장치에 있는 콘텐츠를 TV로 쉽고 편하게 즐길 수 있습니다.
* TV 뒷면의 [USB 입력] 포트에 USB 저장 장치를 연결하고 TV의 입력 모드를 USB 저장 장치로 설정해주세요."
TV,리모컨 배터리,"구매 시 리모컨과 함께 제공되며, 배터리의 유형과 개수를 나타냅니다.
* 배터리 교체 시, 두 개를 모두 동일한 새 것으로 바꾸어야 합니다."
TV,전원선,"전원 어댑터를 제품에 연결한 후, 벽면 콘센트에 전원코드를 연결해줍니다."
TV,대기모드 소비전력,"대기모드는 TV를 시청하지 않을 때에도 TV를 통해 다양한 서비스를 제공하는 기능입니다. 대기 모드 기능 사용하기를 설정하고, TV 시청이 끝난 후 리모컨으로 TV의 전원을 종료하면 대기 모드가 실행됩니다."
TV,에너지소비효율등급,"제품의 에너지 소비 효율을 1부터 5까지로 나눈 제도로 1등급 제품은 가장 에너지를 효율적으로 절약하여 5등급 제품보다 약 30~40% 더 효율적인 에너지 소비를 보여줍니다. 동일 모델이라도 제조일에 따라 등급이 다를 수 있으므로 구매 시에는 제조사 정보를 확인해야 합니다.
 * 제품 출하 시점에 따라 에너지소비효율 등급은 변동될 수 있습니다."
TV,소비전력 (W),전기·전자기기가 운용되기 위해 필요한 단위 시간당 전기 에너지의 양을 말합니다. 단위는 W(와트) 또는 kW(킬로와트) 사용합니다.
TV,정격소비전력 (W),"기기를 사용하는데 필요로 하는 전기적 힘을 말하며, 정격 전자 기기에 대해서 지정된 조건 하에서 제조업자가 보증하는 사용상의 한계입니다. 정격소비전력이 30W라면 그 제품을 사용하기 위해서는 30W의 전력이 필요하다는 의미입니다. "
TV,디밍 방식,"로컬 디밍(Local Dimming)은 백라이트를 다수의 영역으로 구분하여 영상의 어두운 부분에 해당하는 영역은 백라이트를 끄거나 빛을 줄이고, 밝은 영역은 휘도를 높여줌으로써 더 밝게 표현하여 현실에 가까운 화면을 구현하는 기술입니다."
TV,홈허브,TV를 보는 중에도 세탁과 건조 종료 시간을 확인하고 공기 청정기와 로봇 청소기를 작동 시키는 등 우리 집 가전의 상태를 한눈에 확인하실 수 있는 기능입니다.
TV,Apple Homekit 연동,"사용자는 아이폰이나 아이패드의 전용 어플리케이션 또는 애플의 음성인식 비서 서비스 '시리(Siri)' 등을 통해 연동된 기기들을 편리하게 제어할 수 있습니다. 어플리케이션 실행 후 TV를 연동하면 애플 기기에서 전원 작동, 볼륨 조절, 입력모드 전환 등 기본적인 TV 제어 기능을 이용할 수 있습니다."
TV,OLED TV,OLED TV는 픽셀 하나하나 딱 필요한 부분에 필요한 만큼의 빛을 켜기 때문에​ 완벽한 블랙을 표현할 수 있는 TV입니다. 백라이트로 구역마다 빛을 조절해 빛 번짐과 블랙 표현의 한계가 존재​하는 LCD TV와는 차이가 있습니다. 올레드의 경우 픽셀 단위로 빛을 완전히 차단하기 때문에 정확한 블랙으로 무한대 명암비 구현할 수 있습니다. 또한 백라이트가 없어 패널 두께도 아주 얇아 슬림한 디자인이 가능합니다.
TV,QNED,QNED TV는 색 재현력과 정확도를 높여 표현하는 '나노셀' 기술에 풍부한 색감을 제공하는 '퀀텀닷' 기술을 함께 사용하여 색의 표현 능력을 극대화하였습니다. 뿐만 아니라 나노셀 TV보다 더 작고 촘촘한 Mini LED를 사용하여 명암비를 높였습니다.
TV,울트라 HD TV,"UHD(Ultra High Definition)는 일반적인 HD보다 4배 이상 화질이 좋은 초고해상도를 의미하며, Ultra HD TV는 더욱 선명하고 정교한 화면을 제공하여 생동감 있게 표현해줍니다."
TV,나노셀,LCD 표면에 약 1나노미터(nm)의 나노 입자를 입혀 색 정확도와 색 재현력을 높여 화질을 개선한 기술입니다. 어느 각도에서 화면을 보더라도 색이 왜곡되는 현상이 거의 없습니다. 레드와 그린 사이의 색 섞임 현상도 색상 흡수 능력으로 보완되었습니다.
TV,스위블,화면을 손쉽게 좌우로 회전시킬 수 있는 기능입니다.
TV,틸트,상하 각도를 원하는 각도로 쉽게 조절할 수 있는 기능입니다.
